score,sentence1_tr,sentence2_tr
2.75,"FBI, CIA, Kanada Güvenlik İstihbarat Servisi ve Kanada Kraliyet Atlı Polisi sözcüleri El Shukrijumah'ın Kanada'da kalması hakkında yorum yapmaktan kaçındı.","FBI, CIA, Kanada Güvenlik İstihbarat Servisi ve Kanada Kraliyet Atlı Polisi Washington Times'ın haberi hakkında yorum yapmaktan kaçındı."
4.0,"Soruşturma kurulu üyesi Steven Wallace, ""Bu çözülmemiş kalıcı bir sorun olmuştur."" dedi.","Yönetim kurulu üyesi Steven Wallace, ""Bu, mekanik ve fiziksel olarak çözülmemiş kalıcı bir sorundu,"" dedi."
3.6,"""Amerikalılar kesip kaçmaz, bu talihsizliğin üstesinden gelmek zorundayız."" dedi.","Irak'a barış getireceğine de söz verdi: ""Amerikalılar kesip kaçmaz, bu talihsizliğin üstesinden gelmek zorundayız."""
3.8,"""Kimyasal program, biyolojik program, gerçekten de nükleer program, gerçekten de BM tarafından belgelenen her şey hakkında hiçbir şüphe yok.""","Bakan şöyle devam etti: ""Kimyasal program, biyolojik program ve gerçekten de nükleer silah programı hakkında hiçbir şüphe yoktur."
4.6,"Ridge, tatbikatta gerçek patlayıcı veya zararlı cihaz kullanılmayacak dedi.","Ridge, gerçek patlayıcı veya diğer zararlı maddelerin kullanılmayacaklarını söyledi."
3.25,"Burası Amerika dostlarım ve bu burada olmamalı."" dedi.","""Burası Amerika dostlarım ve bu burada olmamalı."""
3.75,"1 Mayıs'ta, dar, dolambaca bir kanyonda süründü, 20 metrelik bir uçurumdan aşağı indi ve kanyonun yaklaşık 10 kilometre aşağısına yürüdü.","Dar, dolambaca bir kanyonda süründü, 20 metrelik bir uçurumdan aşağı indi ve Utah'ın güneydoğusundaki Canyonlands Milli Parkı yakınlarındaki kanyondan yaklaşık 10 kilometre yürüdü."
4.0,"Uluslararası Af Örgütü, son 20 yılda Irak'ta 17 bin kayıp hakkında bilgi topladığını, ancak gerçek rakamın çok daha yüksek olabileceğini söyledi.","Uluslararası Af Örgütü, son 20 yılda Irak'ta 17.000 kayıp hakkında bilgi topladığını açıkladı."
3.75,Texas Instruments dün $1.37 ile $19.25 ve Novellus Systems Inc. $1.76 ile $36.31 arasında yükseldi.,"Texas Instruments 1.37 $US 19.25 $US yükseldi ve Novellus Systems 1.76 $US 36.31 $US yükseldi ve lehman tarafından ""aşırı kilolu"" olarak yükseltildi."
3.455,"Bakan, Ruanda ve Uganda cumhurbaşkanlarıyla bir toplantıya hazırlanmak için geçen haftaki Kabine oturumundan izin almak istedi.",Ruanda ve Uganda cumhurbaşkanlarıyla bir toplantıya katılmak için kabineyi atlamanın son derece sıra dışı adımını attı.
4.0,"Eski putperest ve modern Hıristiyan ayinlerinin bir karışımıyla, köylüler kendilerini fakir tuttuklarına inandıkları talihsizlikleri silme umuduyla bir dizi tören düzenlediler.","Eski Melanezya pagan ve modern Hıristiyan törenlerinin bir karışımında insanlar, uzun zaman önce yemeklerden bu yana onları fakir tuttuklarına inandıkları talihsizlikleri silmek için tekrar çalıştılar."
2.5,"Dow Jones endüstriyel ortalaması. DJI 13.33 puan veya yüzde 0.15 artışla 9,196.55'e yükseldi.","Dow Jones sanayi ortalaması <.DJI> 7.75 puan veya yüzde 0.08 düşüşle 9,175.47 seviyesinden kapandı."
0.25,Monkeypox genellikle sadece orta ve batı Afrika'da bulunur.,Genellikle güneybatı ve batı eyaletlerinde bulunan çayır köpekleri Wisconsin'e özgü değildir.
3.833,"Film, Kasım ayında Matrix Revolutions ile sona erecek olan üçlemenin ikincisi.","""Yeniden Yüklendi"" üçlemenin ikinci bölümüdür; ""The Matrix Revolutions"" Kasım ayında gösterime girmesi planlanıyor."
3.75,"Buna ek olarak, Adalet Bakanlığı FBI'ın camilere ziyaretlerle ilgili ''10'dan az' soruşturma yürüttüğünü açıkladı.","Ayrıca Adalet Bakanlığı, ""10'dan az"" FBI ofisinin İslami camilere yapılan ziyaretlerle ilgili soruşturmalar yürüttüğünü de belirtti."
3.25,"Lansman, bu hafta San Francisco'daki JavaOne geliştiricileri konferansına denk geliyor.",Haber ayrıca San Francisco'daki Suns yıllık JavaOne geliştiriciler konferansı ile birlikte geliyor.
2.75,"Bir Kraliyet Görevi, Galler Prensesi Diana ile olan deneyimlerine ve ona ve ona yazdığı iddia edilen mektuplara dayanmaktadır.","Kraliyet ailesi, eski hizmetkarın Galler Prensesi Diana ile geçirdiği zamana dayanarak A Royal Duty'de daha fazla vahiy için kendini hazırlıyordu."
3.0,"Ordudan yapılan açıklamada, İsrail askerlerinin kentteki Hamas lideri Abdullah Kawasme'yi vurarak öldürmesinin sadece birkaç gün sonra meydana gelen baskında Hamas'taki militanların hedef alındığını belirtildi.","Tutuklamalar, İsrail askerlerinin hebron' daki militan grubun lideri Abdullah Kawasme' yi vurarak öldürmelerinden sadece birkaç gün sonra gerçekleşti."
3.2,"SARS, Toronto bölgesinde iki hemşire ve bir doktor da dahil olmak üzere 44 kişinin hayatına mal oldu.",Virüs Toronto bölgesinde bir doktor ve iki hemşire de dahil olmak üzere 44 kişiyi öldürdü.
4.6,"Şirket Pazartesi günü yaptığı açıklamada, Apple Computer'ın yeni çevrimiçi müzik servisinin ilk haftasında 1 milyondan fazla şarkı sattığını söyledi.","Apple Computer Inc., Pazartesi günü yaptığı açıklamada, bir hafta önce çevrimiçi müzik mağazasının piyasaya sürülmesinden bu yana 1 milyondan fazla şarkı satarak rekor endüstrisi beklentilerini aştığını söyledi."
3.6,Daha önce iki kez izinsiz girmekten tutuklanmış ve annesi ve iki çocuğunun evi olan kompleksten men edilmişti.,Daha önce iki kez izinsiz girmekten tutuklanmış ve kompleksten men edilmişti.
4.4,"Oracle Corp'un Yönetim Kurulu Başkanı ve CEO'su Larry Ellison, şirketin rakip PeopleSoft Inc.'i satın almak için talep edilmeyen teklifini tatlandırmayı dışlamadı.","Oracle yönetim kurulu başkanı Larry Ellison, şirketin rakip PeopleSoft için teklifini yine artırabileceğini ima etti."
4.056,"Portekiz meteoroloji servisinden yapılan açıklamada, Avrupa'nın sıcak hava dalgasının güneydoğudan hareket eden sıcak ve kuru hava kütlesinden kaynaklandığı belirtildi.","Portekiz hava durumu servisinden Mario Almeida, sıcak hava dalgasının güneydoğudan gelen sıcak ve kuru hava kütlesinden kaynaklandığını söyledi."
3.5,Dün düzenledikleri basın toplantısındaTerörizm bahis salonları oluşturmak için vergi mükellefi dolarları harcamak olduğu kadar israftır. dediler.,"Wyden ve Dorgan Pazartesi günü Pentagon'a gönderdiği bir mektupta, Terörizm bahis salonları oluşturmak için vergi mükellefi dolar harcamak olduğu kadar israftır. dediler."
5.0,"Merrill Lynch analisti Steven Milunovich, yine de ""biraz belirsiz kararın"" rakip ürününü nasıl geliştirdiğine bağlı olarak Statik Kontrol için bir gerileme olabileceğini söyledi.","Ancak Merrill Lynch analisti Steven Milunovich, düzenleyicilerin ""biraz belirsiz kararının"" rakip ürününü nasıl geliştirdiğine bağlı olarak Statik Kontrol için bir gerileme olabileceğini söyledi."
4.0,"Maymunlar, kolun şematik bir temsilini ve hareketlerini bir video ekranında izleyerek ilerlemelerini takip edebilirdi.","Kol ayrı bir odada tutuldu, ancak maymunlar kolun bir temsilini ve hareketlerini bir video ekranında izleyerek ilerlemelerini takip edebilirdi."
4.0,"Bu, Washington şehir merkezi ve kuzey Virginia'da trafik arttıkça binlerce yolcuyu rahatsız eden 47 saatlik bir polis açmazını tetikledi.","Protestosu, Washington şehir merkezi ve kuzey Virginia'da büyük trafik sıkışıklığına neden olan polisle 47 saatlik bir izdimaya yol açtı."
4.75,"Standard & Poor's 500 endeksi 6,48 veya yüzde 0,7 artarak 990,51'e yükseldi.",Daha geniş Standart & Fakir 500 Endeksi . SPX 6.48 puan veya yüzde 0.66 artarak 990.51'e yükseldi.
3.75,ABD Tarım Bakanlığı sponsorluğunda düzenlenen üç günlük Tarım Bilimi ve Teknolojisi Bakanlar Konferansı ve Fuarı'na yüzden fazla ülkeden tarım bakanlarının katılması bekleniyor.,ABD Tarım Bakanı Ann Veneman üç günlük Tarım Bilimi ve Teknolojisi Bakanlar Konferansı ve Fuarı'na Pazartesi günü başlıyor.
4.0,"Durumu karmaşıklaştıran, her iki tarafta da savaşan savaşla sertleşmiş Liberyalıların varlığıdır.","Savaş, her iki tarafta da savaşla sertleşmiş Liberyalıların varlığıyla karmaşık hale gelen batıda düzensiz bir şekilde devam etti."
3.5,Bu yıl Audubon Society bir kez daha yıllık Noel Kuşu Sayımı'na ev sahipliği yapıyor.,"Ulusal Audubon Cemiyeti'nin yıllık Noel Kuşu Sayısı, şimdi 104."
3.0,"Kaldırılmadan önce, site katılabilecek bilgisayar korsanları için kuralları İngilizce olarak listeledi.","Organizatörler, http://defacerschallenge.com, katılabilecek bilgisayar korsanları için kuralları bozuk İngilizce olarak listeleyen bir Web sitesi kurdular."
4.2,"Doktorlar, vücudun kendi östrojeninin hücre hasarına karşı koruduğunu ve kan akışını iyileştirdiğini tahmin ettiler.",İnançları östrojenin hücre hasarlarını önlediği ve kan akışını iyileştirdiği spekülasyonlarına dayanıyordu.
3.4,Ayrıca kısalığın ailede işitme kaybı öyküsüyle ilişkili olduğunu buldular.,İşitme kaybı olanlarda iki kat daha sık kısalık bulundu.
4.6,"Cisco yöneticileri, 1,3 milyar dolarlık nakit akışı ve net gelirdeki artış nedeniyle cesaretlendiklerini, ancak bir toparlanma umduklarını söyledi.","Cisco yöneticileri 1,3 milyar dolarlık nakit akışı ve net gelirdeki artış nedeniyle teşvik edildi, ancak bir toparlanma konusunda ''ihtiyatlı iyimser'' kaldıklarını söylediler."
4.0,"Knoxville News Sentinel'e gönderdiği e-posta açıklamasında Shumaker, ''İstifaya önem vermiyorum.","İstifayı dikkate almıyorum."" dedi."
4.0,"Yapılan bir anket, BELEDIYE Başkanı'nın FBI tarafından rahatsız edildiğinin GOP rakibi Sam Katz'a karşı yeniden seçilme çabalarını artırdığını gösterdi.","Bu hafta yayınlanan bir anket, FBI'ın belediye başkanını rahatsız etmesinin yeniden seçilme çabalarını artırdığını gösterdi."
3.6430000000000002,"Jones, John Peter Smith Hastanesi'ndeki yaralı yolcunun Cuma sabahı geç saatlerde öldüğünü söyledi.","John Peter Smith'teki yaralı yolcu sabah saatlerinde öldü; Jones, adının henüz açıklanmadığini söyledi."
3.6,Doktorlar onu 14 Kasım'da veya civarında iki hafta erken doğurtmeyi planlamışlardı.,"Bir Sezaryen aslında Kasım ortasında, iki hafta erken planlanmıştı."
4.0,"Sobig.F, şüphelenmeyen bilgisayar kullanıcıları dosya eklerini ""Teşekkürler!,"" ""Re: Details"" veya ""Re: That Movie"" gibi tanıdık başlıklar içeren e-postalarda açtığında yayılır.","Virüs, şüphelenmeyen bilgisayar kullanıcıları dosya eklerini ""Teşekkürler!"" ve ""Re: Details"" gibi tanıdık başlıklar içeren e-postalarda açtığında yayılır."
1.0,"Teknolojiye bağlı Nasdaq Bileşik Endeksi . IXIC, son verilere göre 17.26 puan veya yüzde 1.06 artarak 1,640.06'ya yükseldi.","Genişleyen Standard & Poor's 500 Endeksi <.SPX> 5,51 puan veya yüzde 0,56 değer kazanarak 981,73'e yükseldi."
3.4,"Grubun kurucuları Matsushita Electric, Sony, Hitachi, NEC, Royal Philips Electronics, Samsung, Sharp ve Toshiba'dır.","CELF'in kurucu üyeleri Hitachi, Matsushita, NEC, Philips, Samsung, Sharp, Sony ve Toshiba'dır."
1.75,"Gıda arzında mı?"" diyor Harvard Risk Analizi Merkezi risk iletişimi direktörü David Ropeik.","Harvard Risk Analizi Merkezi risk iletişimi direktörü David Ropeik, ""Sıfır değil"" dedi."
3.0,"1999'da çığlık atan bir maç sırasında Carolyn, John'a hala Bergin ile yattığını söyledi.","Buna karşılık, ara sıra John'a hala eski erkek arkadaşı ""Baywatch"" hunk Michael Bergin ile yattığını söyledi."
3.25,"Öte yandan, bu Steve'in masumiyetini daha da belirlemeye yardımcı olacaksa, bunu memnuniyetle karşılarız.""","Maryland'deki göletlerin boşaltılması Steve'in masumiyetinin ortaya olmasına daha fazla yardımcı olacaksa, bunu memnuniyetle karşılarız."""
3.4,"Fletcher, çoğu komitede yer alan tarım devletlerinden milletvekillerinin desteğini almayı beklediğini söyledi.","Başbakan, diğer tarım devletlerinden milletvekillerinin de desteğini almayı beklediğini söyledi."
3.2,"20 ve 21 yaşındaki yedi öğrenci, Cumartesi günü erken saatlerde kampüs dışındaki bir otel odasında 16 ve 18 yaşlarındaki iki genç kadınla birlikte alkol almakla ceza yedi.","20 ve 21 yaşındaki yedi erkek öğrenci, 16 ve 18 yaşlarındaki iki kadın gençle cumartesi günü erken saatlerde kampüs dışındaki bir otel odasında yakalandı."
2.8,Böyle bir adım konuyu BM Güvenlik Konseyi'nin önüne getirebilir.,Konu daha sonra BM Güvenlik Konseyi'ne gönderilebilir.
2.4,Dün gece geç saatlerde tahmin edilen nehir tepelenene kadar bütün gün kalmayı planlıyordu.,O ve diğer avukatlar nehir çekilmeye başlayana kadar kalmayı planlıyordu.
3.4,"İnternet sitesine göre kamp, yıl boyunca çocuklar için yaz dini inzivalarına ve diğer etkinliklere ev sahipliği yapıyor.","Web sitesine göre, Ayasofya Kampı yaz aylarında çocuklar için dini inziva yerlerinin yanı sıra yıl boyunca diğer etkinliklere de ev sahipliği yapıyor."
3.6,"Bayiler, tek para biriminin dolar karşısındaki düşüş ivmesinin 1,15 TL'nin altına kırılması halinde hız kazanabileceğini söyledi.","Bayiler, avronun aşağı yönlü ivmesinin 1,15 doların altına inmesi durumunda hız kazanabileceğini söyledi."
3.8,Gemstar'ın hisseleri kapanışta 14 sent artışla 5.49 dolara yükselerek yüzde 2.6 yükseldi.,Gemstar hisseleri haberlerde yükseldi ve Nasdaq'ta yüzde 2.6 düşüşle 5.49 dolardan kapandı.
4.8,"Yonga üreticisi Intel ile birlikte şirketler arasında Sony Corp., Microsoft Corp., Hewlett-Packard Co., IBM Corp., Gateway Inc. ve Nokia Corp.","Yonga üreticisi Intel ile birlikte şirketler arasında Sony, Microsoft, Hewlett-Packard, Uluslararası İş Makineleri, Gateway, Nokia ve diğerleri bulunmaktadır."
3.8,"Ralphs'in sahibi Kroger Co. ve Albertsons Inc., Safeway ile ortaklaşa pazarlık yaptı ve ertesi gün sendikalı işçilerini dışarı kilitledi.",Ralphs'in sahibi Kroger Co. ve Albertson Inc. kurumsal dayanışma göstermek için ertesi sabah işçilerini dışarı kilitlediler.
3.333,"Nüfus Sayım Bürosu'na göre, Hispanik nüfus Nisan 2000 nüfus sayımı rakamlarına göre yüzde 9,8 oranında arttı.","Hispanik nüfus, 1990'lara göre daha az elverişli sosyal ve ekonomik koşullara rağmen Nisan 2000 nüfus sayımı rakamlarına göre 9,8 sent arttı."
2.5,Hisseleri Çarşamba günkü kapanışta 50.90 dolardan açılış öncesi işlemlerde 54.50 dolara fırladı.,Hisse senetleri açılış öncesi işlemlerde neredeyse yüzde 7 sıçrarak Salı günkü kapanışta 17.05 dolardan 18.26 dolara yükseldi.
2.4,"Dow Jones sanayi ortalaması <.DJI> 58.69 puan veya yüzde 0.64 düşüşle 9,137.86 seviyesinden kapandı.",Dow Jones endüstriyel ortalaması. DJI Cuma günü 79.43 puan veya yüzde 0.86 düşerek 9.117.12'ye geriledi.
3.8,"Avukatı Pamela MacKey, Bryant'ın tamamen aklanmış olmayı beklediğini söyledi.","Mackey yaptığı açıklamada, ""Bay Bryant masum ve tamamen aklanmış olmayı bekliyor"" dedi."
3.0,"Endeksin 22,25 değer kazandığı 1 Ekim'den bu yana en iyi ilerleme oldu.","Standard & Poor's 500 endeksi 15,66 artışla 1,046,79'a yükselerek 22,25 değer kazandığı 1 Ekim'den bu yana en iyi avansını elde etti."
3.6919999999999997,"Bay Mask, Bay Cullen'ın Perşembe günü Somerset County Hapishanesi'nden alınacağını ve psikiyatrik bakım için Trenton'un hemen dışındaki Ann Klein Adli Tıp Hastanesi'ne taşınacağını söyledi.","43 yaşındaki Charles Cullen, Somerville'deki Somerset County Hapishanesi'nden Trenton'daki 150 yataklı psikiyatrik tedavi merkezi Anne Klein Adli Tıp Merkezi'ne nakledildi."
3.0,Bilim adamları Stardust'un binlerce toz parçacığı tuzağa düşürtüğüne inanıyordu.,"Stardust, Wild 2'den akan binlerce toz parçacığını toplamak için tasarlanmıştır."
2.75,"Bağımsız uzman komitesi tarafından hazırlanan rapor, Hong Kong hükümetinin SARS krizini ele almasıyla ilgili her türlü şüpheyi ortadan çıkarmayı amaçlıyor.",Hong Kong hükümetinin SARS salgınını ele almasıyla ilgili uzun zamandır beklenen bir rapor yayınlandı.
3.25,Her iki cihaz da yeni kablosuz telefon uygulamalarına temel oluşturmak için v1.2 standardının eSCO tesisini uygular.,BlueCore3 ayrıca Bluetooth iletimi için gelişmiş kablosuz telefon uygulamalarına temel oluşturmak için v1.2'nin eSCO tesisini de uygular.
3.5,"Nisan ayında çekirdek toptan satış fiyatlarındaki düşüş, otomobil, kamyon, erkek ve erkek kıyafetleri ve sigara fiyatlarının düştüğünü yansıttı.","Bu, Ağustos 1993'ten bu yana en büyük düşüş oldu ve otomobil, kamyon, erkek ve erkek kıyafetleri ve sigara fiyatlarının düşmesinden kaynaklandı."
3.0,"Uluslararası kurtarma görevlileri, 20.000'den fazla insanın öldüğü şiddetli bir depremin ardından İran'ın parçalanmış antik İpek Yolu kenti Bam'da hayatta kalanlar için düzleştirilmiş enkazları araştırıyor.","Uluslararası kurtarma görevlileri, dün İran'ın antik İpek Yolu kenti Bam'da kazazedeler ve mezarlıklar için düzleştirilmiş enkazları umutsuzca hackledi."
4.0,"Mount Airy yerlisi Griffith, şimdi Manteo'daki Kuzey Carolina sahilinde yaşıyor.","77 yaşındaki Griffith, Airy Dağı'nda büyüdü ve şimdi Manteo'da yaşıyor."
4.667,"Konferans Kurulu, ABD Tüketici Güven Endeksi'nin Mayıs ayındaki 83.6'dan Haziran ayında 83.5'e düştüğünü bildirdi.","Konferans Kurulu, tüketici güven endeksinin Haziran ayında 83,5 seviyesinden geldiğini ve Mayıs ayındaki revize edilmiş 83,6'dan hafifçe düştüğünü belirtti."
3.333,"Bir siyasetçi, ""Önceliklerinde bir ruh hali değişikliği fark ettim."" dedi.","Iraklı bir siyasetçi Bay Bremer ile görüşmesi sonrasında yaptığı açıklamada, ""Önceliklerinde bir ruh hali değişikliği fark ettim."" dedi."
2.4,Bir trafik kazasında bir bacağını kaybeden 35 yaşındaki Heather'ın kalçalarına doğal doğumu imkansız hale getirecek çelik plakalar takıldığı düşünülüyor.,Eski model Lady McCartney 1993 yılında bir trafik kazasında bir bacağını kaybetti ve kalçalarına doğal doğumu zorlayacak çelik plakalar taktığı anlaşılıyor.
3.8569999999999998,"Kanal ayrıca Cuma gecesi ""Dateline"" sürümünü de bırakıyor.","Kanal, newsmagazine franchise'ı ""Dateline""ın bir baskısını bırakacak."
2.4,Başkan Yardımcısı Dick Cheney ve Mississippi Cumhuriyetçi vali adayı Haley Barbour tezahürat kalabalığı kabul ediyor.,"Başkan Yardımcısı Dick Cheney, Mississippi Cumhuriyetçi Haley Barbour'un hükümeti ve iş anlayışı nedeniyle iyi bir vali olacağını söylüyor."
3.0,"51 yaşındaki hemşire, son salgının merkezi olan North York General Hospital'da çalışıyordu.","51 yaşındaki Emile Laroza, ikinci SARS salgınının merkezi olan North York General Hospital'da hemşire olarak çalışırken SARS'a yakalandı."
2.0,Rusch ayrıca son üç başlangıcının her birinde beş veya daha fazla kazanılmış koşuya izin verdi.,"Redman, dokuz başlangıcının altısında iki veya daha az kazanılmış koşuya izin verdi."
1.6,Bay Turner satılmadan önce yaklaşık 10 milyon hisseyi bir hayır kurumuna devretti.,Satışlar Bay Turner'a AOL'de yaklaşık 45 milyon hisse bırakıyor.
4.0,"Ayrıca, kendisi için sipariş ettiği hileli mallar almaya ikna ederek başkalarını da plana katılmaları için işe aldı.","Ayrıca, sipariş ettiği hileli elde edilen malları teslim almak için başka kişileri de işe aldı."
3.8,New York Mets daha sonra Florida'daki Lakewood Ranch Lisesi'nden dış saha oyuncusu Lastings Milledge'ı seçti.,"Mets, Florida'dan bir dış saha oyuncusu olan Lastings Milledge'ı 12."
1.273,Florida Sen. Bob Graham ankete katılanların yüzde 61'i tarafından tanımlanamadı.,"Kerry, ankete katılanların yüzde 66'sı tarafından olumlu görüldü; Dean yüzde 57'de."
1.0,Daha geniş Standart & Fakir 500 Endeksi . SPX 3.47 puan veya yüzde 0.36 artarak 977.59'a yükseldi.,Teknoloji yüklü Nasdaq Bileşik Endeksi . IXIC 8 puan veya yüzde 0.45 ile 1.645 puana düştü.
3.0,"Sonuç olarak, ilk turda 24 oyuncu eşit kırdı.","24 oyuncu ilk turda, ABD Açık tarihinin en yüksek üçüncü rakamı oldu."
4.0,Albertsons ve Kroger'ın Ralphs zinciri tepki olarak işçilerini kilitledi.,Kroger'ın Ralphs zinciri ve Albertsons dayanışma göstermek için market çalışanlarını hemen kilitlediler.
2.0,"Teknoloji dolu Nasdaq Bileşik Endeksi <.IXIC> 37.78 puan veya yüzde 1.94 düşerek 1,912.36'ya geriledi.",Nasdaq bileşik endeksi dün 37.78 tökezledikten sonra hafta için 2.95 veya yüzde 0.2 düşerek 1.912.36'ya geriledi.
1.0,ŞİÖ hisseleri Pazartesi günü Nasdaq Borsası'nda işlem göre göre 28 sent düşüşle 10.93 dolardan kapandı.,IBM hisseleri New York Borsası'nda 1.75 dolar veya yüzde 2.11 düşüşle 84.50 dolardan kapandı.
3.0,"Meclis, kongrenin federal hükümete kaynak sağlamak için her yıl geçirmesi gereken 13 tasarıdan ilki olan tasarıyı temizlemek için 425'e karşı 2 oyla kabul etti.","Tasarı, Kongre'nin federal hükümeti finanse etmek için her yıl geçirmesi gereken 13 tasarıdan ilki arasında yer alıyor."
4.75,"Knight, 300.000 dolarlık imza bonusu içeren iki yıllık, 2.38 milyon dolarlık bir sözleşmeyi kabul etti.","ESPN,Knight'ın iki yıllık anlaşmasının 300.000 dolarlık imza bonusu da dahil olmak üzere 2.38 milyon dolar değerinde olduğunu bildirdi."
2.75,Japon para birimi karşısında euro 135.92/6.04 yen seviyesindeydi ve New York'un son seviyesi olan 136.03/14 seviyesindeydi.,"Dolar, Japon para birimi karşısında yüzde 0.1 artışla 117.85 yen seviyesindeydi."
4.5,İşlem genellikle ikinci veya üçüncü trimesterde gerçekleştirilir.,"Teknik, hamileliğin ikinci ve bazen üçüncü üç aylık döneminde kullanılır."
3.0,"Hampton ve Newport News'in yanı sıra, hibe Yorktown, King George County, Norfolk ve Virginia Beach'te su testlerini finanse ediyor.","Hibe ayrıca King George County, Norfolk ve Virginia Beach'te plaj testlerini finanse ediyor."
3.0,"Yetkili, saldırganların arkasında Ishtar Sheraton'daki personeli otelde çalışmayı bırakmaya çağıran ve ABD güçlerinin Irak'ı terk etmesini talep eden broşürler bıraktığını söyledi.","Yetkili, saldırganların geride İştar Sheraton'daki işçileri otelde çalışmayı bırakmaya çağıran broşürler bıraktığını söyledi."
3.0,"Yaklaşık 10 aydır devam eden nükleer krizde diplomasi kızışırken, Çin Dışişleri Bakanı Li Zhaoxing'in 13-15 Ağustos tarihleri arasında Güney Kore'yi ziyaret etmesi planlanıyor.","Yaklaşık 10 aydır devam eden krizde diplomasi kızışırken, Çin Dışişleri Bakanı Li Zhaoxing Pazar günü 13 Ağustos'ta Güney Kore'ye giderken Japonya'ya uçuyor."
2.588,Tahvil boğaları Fed'in risklerin ekonomik zayıflığa karşı önyargılı olduğunu kabul etmesini istiyor.,Fed ayrıca ekonomiye yönelik risklerin zayıflığa karşı önyargılı olduğunu söyledi.
3.6,"Gov. James McGreevey, ""İkincil bir çöküş için gerçek bir potansiyel var,"" dedi.","McGreevey, garajın hasarlı alanının ''ikincil bir çöküş için gerçek potansiyel' ile istikrarlı olmadığını söyledi."
2.333,"2 numaralı HP, Unix sunucu satışlarının yüzde 3,6 azalarak 1,36 milyar dolara düştüğünü gördü.","HP, sunucu satışlarının yüzde 0,4 büyüerek 2,9 milyar dolara gerilemesiyle ikinci sıraya geriledi."
2.25,"Ontario'nun kamu güvenliğinden sorumlu komisyon üyesi Dr. Jim Young, ""İnsanlar açıkça rahatsız"" dedi.","Ontario'nun kamu güvenliğinden sorumlu komisyon üyesi Dr. James Young, ""Aşırı uyanık davranıyoruz"" dedi."
2.5,"Diğerlerine ""Dr. Atkins'in Yeni Diyet Devrimi""nin kopyaları verildi ve onu takip etmesi söylendi.","Araştırmacılar karbonhidrat kesicilere ""Dr. Atkins'in Yeni Diyet Devrimi""nin kopyalarını verdiler."
4.5,Rapçinin avukatı Mark Gann yorum çağrılarına cevap vermedi.,"27 yaşındaki rapçinin sivil meseledeki avukatı Mark Gann, yorum çağrılarına cevap vermedi."
4.75,"Ayrıca piyasada tartım General Motors GM haberiydi. N, kısmen emeklilik planında bir delik açmak için 10 milyar dolar borç ihraç etmeyi planlıyor.","Ayrıca haber General Motors GM oldu. N, kısmen emeklilik planında bir delik açmak için 10 milyar dolar borç kesecekti."
3.4,Russin yorum yapmadı; avukatı duruşmaya katılmadı ve telefon mesajlarına cevap vermedi.,Kuzeni Basil Russin olan avukatı duruşmaya katılmadı ve telefon mesajlarına geri dönmedi.
4.0,"Ancak lisans geliri yüzde 21 azalarak 107,6 milyon dolara düştü.","Talebin önemli bir ölçüsü olan lisans satışları yüzde 21 düşerek 107,6 milyon dolara geriledi."
3.5,"Yeni açıklanan hükümet rakamlarına göre, ABD'nin en hızlı büyüyen etnik grubu olan hispanikler, siyahları sollaarak ABD'deki en büyük azınlık haline geldi.","ABD Nüfus Sayım Bürosu tarafından yayınlanan bir rapora göre, hispanikler ABD'deki en büyük azınlık grubu olarak Afrikalı Amerikalıları resmen solladılar."
2.0,Armidale Piskoposu Peter Brain açık sözlüydü.,"Armidale Piskoposu Peter Brain, ""Fazla seçeneği yok"" dedi."
4.0,"Tam olarak faaliyete geçtiğinde, tesiste 1000 kişiye kadar istihdam bekleniyor.","Şirket, fabrikanın tamamen inşa edildiğinde 1000 kişiyi istihdam edeceğini söyledi."
1.4,Amerikan Borsası biyoteknoloji endeksi. BTK yüzde 5 arttı.,Philadelphia Menkul Kıymetler Borsası'nın yarı iletken endeksi. SOXX yüzde 6.10 sıçradı.
