score,sentence1_tr,sentence2_tr
1.8,Landon Ve Bu Noel Hepimiz birçok harikalarla dolu gemileriz.,Ateşle Oyna Hepimiz birçok harikayla dolu gemileriz.
1.8,"Bush, altındaki bütçe için sıfır kredi alır.",Obama da altındaki bütçe için sıfır kredi alıyor.
1.8,. Günahkar insanlar cennete gidemezler.,Ya da günah cennete girdikten sonra kaldırılır.
3.0,Yok olduktan ne kadar sonra çocuk okula dönmeli?,Yok olduktan ne kadar sonra artık çocuğu rahatsız etmemelidir?
3.8,Holly Holy Hepimiz birçok harikayla dolu damarlarız.,Ne Dersen De Hepimiz birçok harikayla dolu damarlarız.
1.2,"Chicago'daki ""cevap"" neydi?",Kaliforniya'da tepki ne olacak?
4.2,Her şey hiç mantıklı değil.,Bunun bir anlamı yok.
4.8,Cinayete meyilli gaz odalarını kim işletiyordu?,Hafızanı tazele: Cinayete meyilli gaz odalarını kim işletti?
3.6,"Bu nedenle, evrenin varlığının açıklaması Tanrı'dır.","Eğer evrenin varlığına dair bir açıklaması varsa, bu açıklama Tanrı'dır."
1.4,Kanser direncine genetik yatkınlık üstün genetiktir.,Alzheimer'a genetik yatkınlık düşük genetiktir.
4.57142857142857,Söylediğin saçma sapal şeyleri fark ettin mi?,"Ve dürüst olmak gerekirse, söylediğin saçma sapal şeyleri fark ettin mi?"
1.2,Kişiyi savunmak için güç kullanımı.-A,Saldırgan tarafından güç kullanımı.
3.6,Mevcut veriler bunu gösteriyor.,Tarihi kayıtlar bunu gösteriyor.
3.0,Dünyaya Sevinç Hepimiz birçok harikayla dolu damarlarız.,Cheers'ın tema şarkısı: Hepimiz birçok harikayla dolu damarlarız.
2.6,Bunun çoğunlukla Hollandalılar olduğunu sanıyordum.,"Aslında, sadece Hollandalılar."
2.2,Çocukların maçını izledim.,Çocukların oyun oynamasını izlemeyi seviyorum.
4.8,"David @OmSigDAVID, bence Santorum Gingrich'ten daha muhtemel.","@sozobe, santorum'un Gingrich'ten daha olası olduğunu düşünüyorum."
2.8,Birbirlerine bakıyorlar!,Neden birbirlerine öyle bakıyorlar?!?!
2.6,Sen mi kullanıyorsun?,Volt mu kullanıyorsun?
1.4,Benim sorunum olan din.,Bu benim sorunum değil.
1.6,Bence Amerikan iş çıkarları için daha iyi olur.,Amerikan toplumu için daha mı iyi olurdu?
4.4,anayasal bir mesele değil.,"Yine söylüyoruz, bu anayasal bir mesele değil."
4.2,SIZI APTALLAR.. örtbası satın aldım.. kanca..,Merhaba Eots: YDT FOOLS.. örtbası satın aldım.. kanca..
1.6,"""Bir numaraya basmak ne işer?""","""Bir numaraya basmak İngilizce yapar."""
4.4,Bu nasıl bir mahkumiyet olurdu?,Daha önce bahsettiğin yerde hangi inançtan bahsediyorsun?
3.8,"Aslen spikdboy tarafından gönderildi Dilekli düşünme değil, oldukça gerçekçi.","Başlangıçta nesnellik tarafından gönderildi Dilekli düşünme değil, oldukça gerçekçi."
3.4,"Trilyonuncu kez, rehabilitasyonun işe yaramadığını söylemedim.","Alıntı yaptığınız nokta ""Rehabilitasyonun asla işe yarayamayacağını söylemedim"" demelidir."
3.0,Charlie Rangel Censured Bunun görüntülerini gören oldu mu?,Bunun görüntülerini gören oldu mu?
2.0,Kırmızı Ekim beklemede.,Kızıl Tilki beklemede.
3.2,Yasal evraklar böyle yazmıyor.,Yasal akıl yürütme böyle yürümez.
3.0,"Hayır, bu faktörlerin hiçbiri son ısınmayı hesaba katmiyor.",Bu faktörlerin ısınmayı hesaba katıp hesaba katmadığını bilmiyorsun.
3.4,"Stone, Kaptan Lord'a haber verdi.",O da Kaptan Lord'a haber verdi.
2.2,"Sistematik Diyalektiğin birincil odağı dia kronik değil, kronik sentezdir.","Böylece, Meta - Sistem - atik Diyalektik Diachronico - Senkron Diyalektiktir."
2.6,Sen mi kullanıyorsun?,Volt mu kullanıyorsun?
0.8,Ve bu GOP kontrollü eyaletlerde oluyor.,Michigan GOP kontrollü bir eyalettir.
4.2,Foxe havzası donmuştu., Foxe çoğunlukla donmuştu.
4.2,"apisa@Frank, Frank, gözlemliyorum ve algılıyorum.","@cicerone sahtekar, Frank, gözlemliyorum ve algılıyorum."
1.2,"Hükümet hangi gebeliklerin dönem dönem taşınması gerektiğine karar veriyor, sorun değil.","Hükümet kendi vatandaşlarını gözetliyor, sorun değil."
2.8,Kalbine Biraz Sevgi Koy Hepimiz birçok harikayla dolu damarlarız.,Landon Ve Bu Noel Hepimiz birçok harikalarla dolu gemileriz.
1.0,Yüzdeden yüksek ama çok yüksek değil.,Yüzdeden düşük ama çok düşük değil.
1.6,Ne nasıl satıldı?,"Nasıl satıldığı önemli değil, GB."
2.6,Tanrı kesinlikle yok.,Tanrı muhtemelen yok.
4.4,"Nefes al, nefes al, hayatına devam et.","Buwhahahaha Nefes Al, Nefes Al, Devam Et."
2.0,İklim değişikliğinin mükemmel bir göstergesidir.,Sanırım hepimiz değişimin doğasında hemfikiriz.
1.8,Burada yaşamanın en güzel yanı yer olması.,"Kötü olan şey, yer olması."
4.5,"Ah ha, ha, ha, ha, ha!","Ha, ha, ha, ha, ha, ha!"
3.8,İfade özgürlüğünün nasıl yasaklanacağını anlamıyorum.,İfade özgürlüğünüz bugünkünden daha fazla yasak olmayacak.
3.2,Sorunun sorulması gerekiyor.,Cevaplanması gereken bir soru.
2.8,Hayata çok değer veriyorsun.,İnsan hayatına çok değer verdiğimi iddia ediyorum.
1.8,Istila mesajları.,Sivrisinekler yayınlar.
4.6,'Umursayan' bir başkan istemiyorum.,Merhametli bir başkan istemiyorum.
2.4,Daha az ilgi çekici hale getirecek bir şeyin var mı yok mu?,Daha ilgi çekici hale getirecek bir şeyin var mı?
3.4,"Trilyonuncu kez, rehabilitasyonun işe yaramadığını söylemedim.","Alıntı yaptığınız nokta ""Rehabilitasyonun asla işe yarayamayacağını söylemedim"" demelidir."
2.4,Klasik Gaz Hepimiz birçok harikayla dolu gemileriz.,Zombiler tarafından Sezonun Zamanı Hepimiz birçok harika ile dolu damarlarız.
4.0,"İşe, yani esasen serbest düşüşte olduğu konusunda hemfikir miyiz?",Serbest düşüşte düştükleri konusunda hemfikir miyiz?
1.0,Yaşam yanlısı insanlar bir kadının kürtajı kendisi için seçebilmesini istemezler.,Seçim yanlısı insanlar kimseye kürtaj yaptırmaya çalışmaz.
3.4,O zaman soruya cevap ver.,Sorudan kaçınmayı bırak.
4.2,Haiti bir bok çukuru.,Haiti tam bir bok çukuru oldu.
1.2,Kesinlikle o sularda bir buzdağı olduğuna inanıyorum.,Titanik yakınlarında hiç buzdağı olduğuna inanmıyorum.
4.4,"The Face Of The Franchise: En kötüsü, Leafs hayranı bile değil!",En kötüsü de Leafs hayranı bile değil!
4.0,"Tamamen katılıyorum, umarım ikinci bir görev dönemine girer.",Umarım ikinci bir görev dönemine girer.
0.4,Jake yardımcı oldu.,Voracek golle.
3.2,Evinin etkilenmiş olması ve okulun etkilenmemiş olması mümkün mü?,"Elbette, evi etkilenmiş olabilir, ama okul değil."
4.2,İnsanlar uyanmıştı.,Çünkü insanlar uyanmıştı.
4.0,Kaliforniya bir kargo gemisiydi.,Kaliforniya bir kargo gemisiydi.
2.6,"Umm, bu açıkça diyor ki, ""tüzük anayasal kabul edilir.""","Ve buna karar verene kadar, ""tüzüğün anayasal olduğu varsayılıyor."""
3.4,Florida Cehalet senindir!,Cehalet senindir!
1.6,Trayvon için adalet için bağıracağım.,Trayvon için adalet için bağıran insanların hepsi ikiyüzlü.
2.2,Neyin doğru neyin yanlış olduğunu nereden biliyorsun?,Hangi hikayenin doğru olduğunu nereden biliyorsun?
5.0,"Ha, ha, ha, ha, ha, ha!","Ah ha, ha, ha, ha, ha!"
0.6,Nugent da söylediklerini söylemekle aptallık etti.,Natalie hayran kitlesine hakaret ettiği için tam bir aptaldı.
1.2,Hepsi Bush'un suçu.,Obama Bush'un hatası.
2.4,Yahudileri nefret ettiğin her şeyin önsezini yapmayı ya da sone eklemeyi bırakmalısın.,"Her şeyi ""Yahudi'den nefret ediyorsun"" diye önek ya da sonekle değilim."
2.4,Siyahların isyan edeceğini söylediği noktayı kaçırdım.,Siyahlar isyan edecek demedim mi?
2.0,Yine de bunu beyan etmek zorunda değildin.,Ve buna gerek yoktu.
4.6,Atasözleri Vaftizci Yahya doğuştan bir Nazarite idi.,Vaftizci Yahya doğuştan nazaritti.
2.2,James: esersiz inancın öldüğünü söylüyor.,"Paul, iş olmadan inanç vaaz etmedi."
1.53333333333333, milyar. Dünyadaki herkes Meksika'nın şu anki refah seviyesinde.,"Dünyadaki herkes Kuzeybatı Afrika'nın şu anki ""refah"" seviyesinde."
4.6,ve videolar Sismik veriler çökme süresine eşit değildir.,Sismik veriler çökme süresine eşit değildir.
2.2,İlk olarak Lone Fox tarafından yayınlandı Bunu şimdi birçok kez söylediniz.,Aslen Lone Fox tarafından gönderildi ve hepsi İran ile ilgili de değil.
2.6,Obama'nın görüşlerini beğenmeyebilirsin ama onun görüşleri var.,"Sahip olduğu pozisyonları beğenmeyebilirsin, ama en azından o pozisyonlara sahip."
3.0,Ama gerçekten o sularda bir buzdağı olduğuna inanıyor musun?,Kesinlikle o sularda bir buzdağı olduğuna inanıyorum.
1.4,Muhafazakarlar arasında Obama için bir kazanç yok.,Bunu muhafazakar biri bunu söyledi.
1.6,"Şeytan, uzak durmak yerine hoşgörünün temsilidir!",. Şeytan diğer yanağını çevirmek yerine intikamı temsil eder!
3.8,O satıştan aldığı vergi ödendiği sürece.,Vergi ödendiği sürece.
1.2,düzeltmek?: İslam'ın kendisi siyasi değildir.,İslam her zaman politik olmuştur.
4.0,Mart aynı zamanda Çİn'deki ayaklanmanın tarihidir.,Başlangıçta Vitchilo March tarafından yayınlanan aynı zamanda Çİn'deki ayaklanmanın tarihidir.
5.0,Umarım her şey yolundadır!,Umarım her şey yolundadır.
3.2,Soruyu ABD'lilere sınırlamanın neden saçma olduğunu anlıyor musun?,ABD'de ikamet etmeyenlerin istatistiklerle neden de ilgili olduğunu anlıyor musunuz?
4.0,Geçmişte Varşova üzerinde UFO görmüştüm.,"Saygılarımla, Steve geçmişte Varşova üzerinde UFO gördüm."
4.6,hangi eylemin o anın çılgın melodi gündemini daha da ileriye taşıdıklarına bağlı olarak.,hangi eylemin lonny-tunes gündemini daha da ileriye taşıdıklarına bağlı olarak.
3.8,Hiçbir iddiada bulunmadığımı kabul ediyor musunuz?,Böylece hiçbir iddiada bulunmadığımı kabul edecek ve doğrulayacaksınız.
2.4,"Zimmerman, arabası tarafından yumruklandığını söylüyor.","""Arkadaşları"" arabasıyla karşı karşıya geldiğini söylüyor."
4.6,"Ortadoğu'da ""SAVAŞ"" diye bir şey yok.",Orta Doğu'da savaş yok.
3.8,Yaşam yanlısı olan bir kısım da yasal kürtaj karşıtlığıdır.,"Yaşam yanlısı aynı zamanda sadece ""kürtaj karşıtlığı"" anlamına gelir."
2.8,"Sermaye kazançları, en yüksek oran: yüzde."," - Gelir, en yüksek oran: yüzde."
2.8,Zombiler tarafından Sezonun Zamanı Hepimiz birçok harika ile dolu damarlarız.,Cheers'ın tema şarkısı: Hepimiz birçok harikayla dolu damarlarız.
4.0,"Hayır, sana kasıtlı olarak cahil olduğunu gösteriyorum.","LOL, çok cahilsin."
3.0,Hepimiz birçok harikayla dolu damarlarız.,Bobby Helm'den Jingle Bell Rock Hepimiz birçok harikayla dolu gemileriz.
2.46666666666667,Sorun kimin parası olduğu değil.,Sorun kimin parası olmadığı.
2.8,Ne yazık ki Ford vergi mükelleflerinin parasını kabul etti.,Ford şirketi kurtarmak için vergi mükelleflerinin parasını kabul etmedi.
1.0,Müslümanlar da Kur'an için aynı şeyi söylerlerdi.,Hindular da Bhagavad Ghita için aynı şeyi söylerdi.
3.8,Kafa karışıklığın beni yalancı yapmaz.,O zaman kafa karışıklığın beni de yalancı yapmaz.
1.6,Hristiyanlar aşırı olduğunda sadece dindir.,Müslümanlar aşırıya kaçtıklarında bu terörizmdir.
1.2,Bazıları 'hakkın' en önemli olduğuna inanıyor.,Bazıları doğmamışları katletmenin en önemli olduğuna inanır.
1.6,"Evrim bir fikir, inanç değildir.","Atom teorisi bir fikir, inanç değildir."
2.8,Başka bir kadının cesedi üzerinde karar verme hakkını iddia eden ben değilim.,Başkalarının bir kadın bedenine karar vermelerini istiyorsun.
0.8,Ron Paul dünyanın neresinde?,MEDYA dünyanın neresinde??
2.4,Pentagon'da bir füze kalıntısı yok.,Pentagon'da A'dan geriye bir kalıntı yok.
3.4,"Alıntı yaptığınız nokta ""Rehabilitasyonun asla işe yarayamayacağını söylemedim"" demelidir.","Trilyonuncu kez, rehabilitasyonun işe yaramadığını söylemedim."
1.53333333333333, milyar. Dünyadaki herkes Meksika'nın şu anki refah seviyesinde.,"Dünyadaki herkes Kuzeybatı Afrika'nın şu anki ""refah"" seviyesinde."
3.8,saçım güzel şey tho :/ Alıntı: Ditto.,saçım güzel şey tho :/ woops!
1.2,Şaka evliliklerini durdurmaz.,Ve ben evlilik için savaşmam.
1.6,Fakir insanların yaptıklarından sorumlu olmadığını düşünüyor gibisin.,İnsanlar yaptıklarından sorumludur.
2.4,Bu işlem neden yapıldı?,İşlem gerçekleşti mi?
0.0,Bagajla ilgili.,Aynı şey değil.
3.6,Hepimiz birçok harikayla dolu damarlarız.,Kalbine Biraz Sevgi Koy Hepimiz birçok harikayla dolu damarlarız.
2.46666666666667,Sorun kimin parası olduğu değil.,Sorun kimin parası olmadığı.
1.6,Baykuşun katılmadığını nereden çıkardın?,Katılmadığı yazmıyor.
1.8,lol Dahililerinizi görmek için sabırsızlanıyoruz!,Görmek için sabırsızlanıyoruz!
1.2,Aslen jacko tarafından gönderildi!,Aslen IZZY tarafından gönderildi!
4.8,İpliğe başladığın için teşekkürler Candy.,Candy- Bugün bize başladığın için teşekkürler.
1.0,Ama öyle değildi.,Ama yapamadılar.
2.2,"Sana borcum varsa, bir sorunum var.","Sana bir trilyon dolar borcum varsa, bir sorunun var demektir."
4.8,Bir pozisyonu destekleyecek kanıt sağlanmazsa; o zaman reddedilmelidir.,Bir pozisyon doğrulanamazsa; o zaman reddedilmelidir.
1.4,Meksika'nın şu anki refah seviyesindeki herkes.,"Dünyadaki herkes Kuzeybatı Afrika'nın şu anki ""refah"" seviyesinde."
1.8,"Bush, altındaki bütçe için sıfır kredi alır.",Obama da altındaki bütçe için sıfır kredi alıyor.
0.8,LOL ABD'de araç kullanmak için teste ihtiyacınız yok mu?,ABD'de ateşli silah sahibi olmak için bir test var mı?
3.2,İkimiz de filmin iyi olduğunu düşündük ve hiçbir şekilde kafa karıştırıcı bulmadık.,İyi olduğunu düşündüm ve kafa karıştırıcı bulmadım.
5.0,Eğer Tanrı yoksa ahlaki olarak yanlış bir şey olabilir mi?,"Tekrar soruyorum, Eğer Tanrı yoksa ahlaki olarak yanlış bir şey olabilir mi?"
3.6,Bir yasa Anayasa ile çelişmiyorsa anayasaldır.,Anayasayı ihlal etmek anlamına gelir.
1.2,Aslen Müslüman kız ooops üzgünüm tarafından gönderildi!,"Aslen Müslüman kız tarafından gönderildi, tam bir imkansızlık değil."
1.4,Burası senin ülken değil.,Burası bizim ülkemiz.
1.0,Aslen zaf tarafından yayınlanmış sanırım ortadaki su bir fark yaratıyor.,"Başlangıçta zaf tarafından uzun vadede gönderildi, evet."
4.2,Cone bir oyun attı.,Addie Joss Cone bir oyun çıkardı.
4.8,LashL tarafından düzenlendi: Küfürleri düzgün bir şekilde maskelemek için düzenlendi.,LashL tarafından düzenlendi: Alıntılanan gönderide küfürleri düzgün bir şekilde maskelemek için düzenlendi.
1.6,Jüriye jürinin hükümsüz kılınması hakkında bir şey söylenmedi.,Verdiğiniz alıntının jürinin hükümsüz kılınmasıyla bir ilgisi yok.
1.0,Kurbanı aşağı koşturarak kanıtın var mı?,Paranoyak bir kanıtın var mı?
4.2,"Arama düğmesini pek kullanmıyorsun, değil mi?","Arama düğmesini hiç kullanmıyorsun, değil mi?"
3.6,Paul'un şansı olduğunu sanmıyorum.,Paul'un şansı yok.
3.2,Zombiler tarafından Sezonun Zamanı Hepimiz birçok harika ile dolu damarlarız.,Dünyaya Sevinç Hepimiz birçok harikayla dolu damarlarız.
4.57142857142857,Söylediğin saçma sapal şeyleri fark ettin mi?,"Ve dürüst olmak gerekirse, söylediğin saçma sapal şeyleri fark ettin mi?"
1.0,Ya bir çalışmayı berbat ederlerse?,Ya kişisel bir önyargıları varsa?
1.2,Özellikle de bir Baptist.,Özellikle Gnostic.
0.8,Ve doğu kıyısının büyük bir kısmı.,Ve batı yakasının bazı kısımları.
1.4,Neden İbrani kabilelerindeki kadınlardan bahsediyorsun?,"Savaş ödülü olarak kadınlardan bahsediyorduk, değil mi?"
2.6,Dün gece Japon kuvvetleri Hong Kong'a saldırdı.,Dün gece Japon kuvvetleri Filipin Adaları'na saldırdı.
3.6,". ""Yaşam gücü"" tanımınız nedir?","""Soul"" tanımınız nedir?"
2.6,Bu seçmenlere doğrudan sorumluluk değildir.,Evet ama seçmenlerine karşı sorumlular.
4.0,"İdeoloji şiddetli genişleme etrafında inşa edildi, yani evet - VIOLENT genişlemesi.",İdeoloji şiddetli genişleme ve ırk üstünlüğü üzerine inşa edildi.
4.6,Bu bir enema olabilir mi?,"@ossobuco, bu bir enema olabilir mi?"
0.4,Son sözüm: görmezden gelmek normalleşme etkisine sahiptir.,avantaj elde etmek takviye etkisine sahiptir.
4.4,Sorun büyük olasılıkla mekik filosu tekrar uçmaya başlamadan önce düzeltici değişiklikler anlamına gelecektir.,Uzay mekiği filosunun tekrar uçması için temizlenene kadar sorunun düzeltilmesi gerektiğini söyledi.
3.4,"SEC Başkanı William Donaldson, ""polisin tempoda olduğuna dair bir güven inşa etmek"" olduğunu söyledi.","""Bence polisin tempoda olduğuna dair bir güven var."""
4.6,"Özel doktoru, Myanmar'ın demokrasi yanlısı lideri Aung San Suu Kyi'nin Cuma günü geç saatlerde eve döneceğini, ancak Yangon'daki bir hastanedeki ameliyattan çıktıktan sonra gözaltında kalacağını söyledi.","Özel doktoru Cuma günü yaptığı açıklamada, Myanmar'ın demokrasi yanlısı lideri Aung San Suu Kyi'nin ameliyat olduğu hastaneden serbest bırakılmasının ardından ev hapsinde tutulacağını söyledi."
1.4,Spitzer sözcüsü Darren Dopp Perşembe günü geç saatlerde yorum yapmaktan kaçındı.,"Washington'daki komisyonun sözcüsü John Heine, Bay Spitzer'ın eleştirileri hakkında yorum yapmaktan kaçındı."
2.0,"Avrupa'da öğleden sonra işlemlerde Fransa'nın CAC-40'ı gelişmiş ve İngiltere'nin FTSE 100 endeksi yüzde 0,7 değer kazanırken, Almanya'nın DAX endeksi yüzde 0,6 yükseldi.","Avrupa'da Fransa'nın CAC-40 endeksi yüzde 1,3, İngiltere'nin FTSE 100 endeksi yüzde 0,2 ve Almanya'nın DAX endeksi yüzde 0,6 değer kazandı."
3.6,Sens. John Kerry ve Bob Graham konuşma davetlerini reddettiler.,Gösteriye massachusetts'den Sens. John Kerry ve Florida'dan Bob Graham geldi.
4.4,"Page, Y kromozomunda bulunan genlerin hastalığa yatkınlıktaki cinsiyete özgü farklılıkları etkileyebileceğini de söyledi.","Y üzerindeki genlerin, hastalığa yatkınlıkta cinsiyete özgü farklılıkları etkilemede rol oynayabileceğini de sözlerine ekledi."
4.8,"Mizacın en iyi çalışılan taraflarından biri, insanların yeniliklere nasıl tepki verdiklerine dairdir.","Mizacın belirleyici ve iyi çalışılmış özelliklerinden biri, insanların yeniliğe nasıl tepki verdiklerine dairdir."
4.6,Ancak sabah 1'den akşam 1'e kadar daha erken bir ışık döngüsüne maruz kalan kelebekler kendilerini güney-doğuya yönlendirdi.,"Ancak daha önceki bir ışık döngüsü altında bulunan kelebekler, 1:00-13.m.m."
2.8,"Dunlap hem mayo yarışmasını hem de yarışmanın yetenek bölümünü ""If I Could"" şarkısını söyleyerek kazandı.","""If I Could"" şarkısını söyleyerek yetenek bölümünü kazandı ve ayrıca gece kıyafetleriyle kazandı."
4.0,"Güney Asya'yı, yüzde 62'si kadın olmak üzere 1,1 milyon gencin enfekte olduğu yer alıyor.","Güney Asya'da enfekte olan 1,1 milyon kişinin %62'si kadın."
4.25,"Bir saat sonra, bir İsrail helikopteri Gazze'de bir arabaya füze fırlattı ve iki Hamas yetkilisi ve en az beş kişi daha öldü.","Filistinli kaynaklar, bir saat sonra İsrail saldırı helikopterlerinin Gazze kentinde bir arabaya füze yağdırdığını ve yedi kişinin öldüğünü söyledi."
5.0,"AAA sözcüsü Jerry Cheske, fiyatların bazı planları etkilemiş olabileceğini, ancak ucuz otel anlaşmalarının etkiyi azalttığını söyledi.","AAA sözcüsü Jerry Cheske, fiyatların bazı planları etkilemiş olabileceğini, ancak ucuz otel anlaşmalarının bunu telafi ettiğini söyledi."
3.5,Gruner ve Jahr'ın kendisini önemli editoryal kararlardan çıkararak onunla olan sözleşmesini bozdığını söyleyerek 125 milyon dolara karşı dava açtı.,125 milyon dolara karşı dava açtı ve G+J'nin kendisini önemli editoryal kararlardan çıkararak sözleşmesini bozdığını ve derginin finansal rakamlarını manipüle ettiğini söyledi.
2.5,Standard Edition işlemci başına 15.000 $ veya adlandırılmış kullanıcı başına 300 $ 'dır.,"Standard Edition One, Oracle Standard Edition Database'in tek işlemcili sürümüdür."
4.4,"Microsoft, bu yılın başlarında Connectix'in varlıklarını satın aldığında Virtual PC'yi satın aldı.","Microsoft, virtual pc'yi bu yılın başlarında geliştiricisi Connectix'ten satın aldı."
3.4,Leon Williams'ın cesedi Tompkinsville'deki 196 Bay Caddesi'ndeki üçüncü kattaki dairesinde bulundu.,"Ölen adam, Leon Williams, üçüncü kattaki dairesinde bulundu."
4.0,11 Eylül'de New York ve Washington'a düzenlenen terör saldırılarından bu yana yapılan ilk tatbikat.,"Bu, ülkenin 11 Eylül terör saldırısından bu yana 11 Eylül'den bu yana 2018'de 2018'de 2018'de 2018'de 2018'de 2018'de 2018'de 2018'de 2018'de"
4.8,"Ursel Reisen otobüsü işlettiği doğrulandı, ancak yolcuların karışık yaşlarda olduğunu söylemek dışında hiçbir ayrıntı vermedi.","Ursel Reisen, otobüsü işlettiğini doğruladı, ancak yolcuların karışık yaşlarda olduklarını söylemek dışında ayrıntıları vermekten kaçındı."
3.6,"Örgüt, güneydeki Basra kentinde toplam 17 vakanın doğrulandığını açıkladı.",Dünya Sağlık Örgütü tarafından dün Irak'ın güneyindeki Basra kentinde toplam 17 doğrulanmış kolera vakası bildirildi.
3.4,Bölge gezisi sırasında Yemen ve Bahreyn'i de ziyaret etmesi bekleniyordu.,"Pazartesi günü Beyrut'a gelen Khatami'nin Suriye, Yemen ve Bahreyn'i de ziyaret edecekti."
3.6,"General Myers gazetecilere verdiği demeçte, ""ilk bakışta herhangi bir kural çiğnenmiş gibi görünmediğini"" söyledi.","Genelkurmay Başkanı General Richard Myers, ""İlk bakışta, herhangi bir kural çiğnenmiş gibi görünmüyor,"" dedi."
3.4,"Millville oğlunun fedakarlığının duyulmayacağını kanıtlayan Belediye Başkanı James Quinn, önümüzdeki 30 gün boyunca tüm şehir bayraklarının yarıya indirilmesini emretti.","Dün Millville'de, Belediye Başkanı James Quinn önümüzdeki 30 gün boyunca yarım personelle tüm şehir bayraklarının uçurulmasını emretti."
4.25,"Ohio merkezli Doğu Orta Alan Güvenilirlik Konseyi Kanton'un operasyon ve kaynak müdürü Tom Kraynak, senaryonun müfettişlerin düşündüğü birçok senaryo arasında yer aldığını söyledi.","Ohio merkezli Doğu Orta Alan Güvenilirlik Konseyi Kanton'un operasyon ve kaynak müdürü Tom Kraynak, müfettişlerin senaryoyu değerlendirdidiğini söyledi."
4.25,Sadece ozon kolesterolü bozduğunda üretilebilen moleküller buldular.,Ve tüm örnekler sadece kolesterol ozonla etkileşime girdiğinde üretilebilen moleküller içeriyordu.
3.846,Bir santimetreküpte yaklaşık 12 saatlik müziğe eşdeğer bir gigabayttan fazla bilgi depolayabilir.,Ve 1.000 yüksek kaliteli görüntüye veya yaklaşık 12 saatlik müziğe eşdeğer bir gigabayttan fazla bilgiyi sadece bir santimetreküpte saklayabilir.
1.2,"Bu ayın başlarında RIM, hisse başına 7 sent ile 11 sent arasında ikinci çeyrek kazancı bildirmeyi beklediğini söylemişti.","Yasal ücretler ve diğer ücretler hariç olmaksa, hisse başına 1 ila 4 sent arasında bir kayıp bekliyordu."
3.2,"Dün yayınlanan özlere göre, ""Benim için Lewinsky imbroglio, siyasi muhalifler tarafından üretilen başka bir kısır skandal gibi görünüyordu.""","Bayan Clinton, ""Benim için Lewinsky imbroglio, siyasi muhalifler tarafından üretilen başka bir kısır skandal gibi görünüyordu,"" diye yazıyor."
3.8,"Savcılar, 2001 ve 2002'de şirketin 40 hesabının 4'ünden yapılan havalelerin toplam 3,2 milyar dolardan fazla olduğunu ileri sederek, ""2001 ve 2002'de, şirketin 40 hesabından yapılan havalelerin toplam 3,2 milyar dolardan fazla olduğunu"" ileri sederek, 2001 ve 2002'de 40'tan fazla banka havalesi gerçekleşti.","Morgenthau, Beacon Hill'de açılan 40 hesabın dördünden yapılan havalelerin 2001'den 2002'ye kadar toplam 3,2 milyar dolardan fazla olduğunu söyledi."
3.2,"Stony Brook Üniversitesi, daha önceki çalışmaların elektromanyetik alanlar ile kanser arasında olası bir bağlantı olduğunu belirtmesi üzerine çalışmayı 1996 yılında başlattı.","Stony Brook'taki Devlet Üniversitesi, daha önceki çalışmaların olası bir bağlantı olduğunu belirterek çalışmayı 1996 yılında başlattı."
4.0,"Daha önce, bir polis emrine karşı gelip, Beşir sıkı korunan mahkeme salonundaki koltuğuna yürürken ""Allahu Ekber"" (Tanrı En Büyüktür) diye ağlamışlardı.","Daha önce, Beşir'in destekçileri bir polis emrine karşı gelmiş ve koltuğuna yürürken ""Allahu Ekber (Tanrı En Büyüktür)"" diye ağlamıştı."
3.333,"Metropolitan Ambulans sözcüsü James Howe, dünkü olaydan sonra beş kişinin hastaneye kaldırıldığını ve üçünün olay yerinde tedavi edildiğini söyledi.","Sözcü James Howe, yaşları 4 ile 17 arasında değişen beş çocuğun boyun ve göğüs yaralanmasıyla hastaneye kaldırıldığını, diğer üç çocuğun ise olay yerinde tedavi edildiğini söyledi."
2.0,Ancak Ortak İstihbarat Komitesi'nin bu işe karışmadığı açık.,Bu rapor Ortak İstihbarat Komitesi tarafından temizlendi.
2.6,"Yirmili yaşların yaklaşık% 22'si obezdir, bu da sağlıklı bir kilonun yaklaşık 30 pound üzerindedir.",Amerikalıların yaklaşık yüzde 31'i şu anda obez - sağlıklı bir kilonun yaklaşık 30 veya daha fazla pound.
3.0,"Hit bir İngiliz komedisinin Amerikan versiyonu olan Coupling, değerli Perşembe 21:30.m. zaman dilimini alacak.","Hit bir İngiliz komedisinin Amerikan versiyonu olan Coupling, Perşembe günleri Friends ile çift olacak."
2.6,Cesedi birkaç hafta sonra Green River'da bulundu.,"15 Ağustos 1982: Chapman, Hinds ve Mills kalıntıları Green River'da bulundu."
